{
  "protocolVersion": "1.0",
  "requestId": "b8b88ff4-36c0-4bdc-a5c1-8a976dc7d2cf",
  "timestamp": "2026-07-26T05:30:00Z",
  "deadline": "2026-07-26T05:30:03Z",
  "action": "entities.describe",
  "sessionToken": "QmFzZTY0dXJsLXNlc3Npb24tdG9rZW4tdjEtMzItYnl0ZXM",
  "payload": {
    "entities": [
      { "kind": "item", "resourceId": "create:mechanical_press" },
      { "kind": "block", "resourceId": "minecraft:crafting_table" }
    ]
  },
  "error": null
}
