{
  "protocolVersion": "1.0",
  "requestId": "b8b88ff4-36c0-4bdc-a5c1-8a976dc7d2cf",
  "timestamp": "2026-07-26T05:30:01Z",
  "deadline": "2026-07-26T05:30:03Z",
  "action": "health.ping",
  "sessionToken": null,
  "payload": {
    "nonce": "fixed-nonce",
    "gameReady": false,
    "protocolVersion": "1.0"
  },
  "error": null
}
