{
  "protocolVersion": "1.0",
  "requestId": "b8b88ff4-36c0-4bdc-a5c1-8a976dc7d2cf",
  "timestamp": "2026-07-26T05:30:00Z",
  "deadline": "2026-07-26T05:30:03Z",
  "action": "world.structure.locate",
  "sessionToken": null,
  "payload": {
    "summary": { "authority": "generator_located", "dimensionId": "minecraft:overworld", "observedAtTick": 120, "queryGeneration": "z1", "requested": 1, "loaded": 0, "examined": 1, "matched": 1, "complete": true, "truncated": false, "warnings": [] },
    "targetId": "minecraft:village", "displayName": "Village", "x": 100, "z": -40, "y": null, "distanceBlocks": 108, "radius": "standard", "queryCount": 1
  },
  "error": null
}
