{
  "protocolVersion": "1.0",
  "requestId": "b8b88ff4-36c0-4bdc-a5c1-8a976dc7d2cf",
  "timestamp": "2026-07-26T05:30:00Z",
  "deadline": "2026-07-26T05:30:03Z",
  "action": "world.registry.resolve",
  "sessionToken": null,
  "payload": { "revision": "z1", "matches": [{ "kind": "structure", "resourceId": "minecraft:ancient_city", "translationKey": "structure.minecraft.ancient_city", "displayName": "Ancient City" }], "truncated": false },
  "error": null
}
