{
  "protocolVersion": "1.0",
  "requestId": "b8b88ff4-36c0-4bdc-a5c1-8a976dc7d2cf",
  "timestamp": "2026-07-26T05:30:00Z",
  "deadline": "2026-07-26T05:30:03Z",
  "action": "hud.show",
  "sessionToken": "QmFzZTY0dXJsLXNlc3Npb24tdG9rZW4tdjEtMzItYnl0ZXM",
  "payload": {
    "text": "中文语音助手🙂 §a绿色 \"引号\" \\反斜杠\n换行",
    "severity": "info",
    "durationMs": 3000
  },
  "error": null
}
